{
  "$schema": "https://json-schema.org/draft/2020-12/schema",
  "title": "QueryResult",
  "type": "object",
  "required": ["status", "action", "data", "meta", "errors"],
  "properties": {
    "status": {"type": "string"},
    "action": {"type": "string"},
    "data": {"type": "object"},
    "meta": {"type": "object"},
    "errors": {"type": "array", "items": {"type": "string"}}
  }
}

